{
  "dn": "o=Landstinget i Värmland,st=Uppsala-Örebro regionen,c=Sverige",
  "measurement": {
    "name": "Patientnämnden 2016",
    "grouping": "Patientnämnden",
    "period": "2016"
  },
  "selectionCriterias": [
    {
      "name": "Alla",
      "versions": [
        {
          "name": "Alla",
          "questionnaire": {
            "name": "Patientnämnden 2.0"
          }
        }
      ]
    }
  ],
  "organisations": [
    {
      "dn": "o=Landstinget i Värmland,st=Uppsala-Örebro regionen,c=Sverige"
    }
  ]
}