{
    "_id": "348762348263482763",
    "measurement": {
        "name": "Primärvård 2015",
        "grouping": "Primärvård",
        "period": "2015"
    },
    "previousMeasurement": {
        "name": "Primärvård 2014",
        "grouping": "Primärvård",
        "period": "2014"
    },
    "hsaId": "SE2321000131-E000000000001",
    "dn": "ou=Primärvård,o=Västra Götalandsregionen,st=Västra regionen,c=Sverige",
    "status": "generated",
    "created": "2015-01-01",
    "alternativeIdSystem": "PASIS",
    "diarie": {
        "number": "123123123",
        "link": "http://www.somesystemthathandlesthis.com"
    },
    "selectionCriterias": [
        {
            "name": "Läkarbesök",
            "versions": [
                {
                    "name": "Alla",
                    "questionnaire": {
                        "name": "Primärvård Läkarbesök Utökad v2.0"
                    }
                }
            ]
        },
        {
            "name": "Sjuksköterskebesök",
            "optOut": true,
            "versions": []
        }
    ],
    "specific": {},
    "organisations": [
        {
            "dn": "ou=Primärvård,o=Västra Götalandsregionen,st=Västra regionen,c=Sverige",
            "specific": {
                "managerEmails": [
                    "chefNarhalsan@vgr.se"
                ]
            }
        },
        {
            "dn": "ou=Område 06,ou=Primärvård Offentlig,ou=Primärvård,o=Västra Götalandsregionen,st=Västra regionen,c=Sverige",
            "specific": {
                "managerEmails": [
                    "chefOmråde6@vgr.se"
                ]
            }
        },
        {
            "dn": "ou=Närhälsan Gråbo vårdcentral,ou=Område 06,ou=Primärvård Offentlig,ou=Primärvård,o=Västra Götalandsregionen,st=Västra regionen,c=Sverige",
            "hsaId": "SE2321000131-E000000000430",
            "alternativeId": "12346",
            "previousDn": "ou=Närhälsan Gråbo vårdcentral,ou=Område 06,ou=Primärvård Offentlig,ou=Primärvård,o=Västra Götalandsregionen,st=Västra regionen,c=Sverige",
            "publicDn": "ou=Vårdcentralen Gråbo,ou=Lerum,o=Västra Götaland,c=Sverige",
            "specific": {
                "managerEmails": [
                    "chefGrabo@vgr.se"
                ]
            },
            "invitation": {
                "softName": "Gråbo Närhälsa",
                "change": "Närhälsan Gråbo vårdcentral hette tidigare Vårdcentralen Gråbo",
                "signedBy": "John Doe, överläkare"
            },
            "selections": {
                "maxAmountDoctor": 200,
                "maxAmountNurse": 100
            },
            "metadata": {
                "producer": "landstingsdriven",
                "throughput": {
                    "maxAmountDoctor": 1700,
                    "maxAmountNurse": 2900
                },
                "doneEdit": "true"
            }
        }
    ],
    "questions": [
        "Hur upplever du ${verksamheten} tillgänglighet per telefon?",
        "Kände du förtroende för den läkare som du träffade?",
        "Hur värderar du som helhet den vård/behandling du fick?"
    ]
}
