{"dn":"o=Jämtlands läns landsting,st=Norra regionen,c=Sverige","measurement":{"name":"Standardiserade vårdförlopp inom cancervård 2016","grouping":"Standardiserade vårdförlopp inom cancervård","period":"2016"},"selectionCriterias":[{"name":"Alla","versions":[{"name":"vuxen","questionnaire":{"name":"Specialiserad sjukhusvård öppen vuxen 2.0"}}]}],"organisations":[{"dn":"o=Jämtlands läns landsting,st=Norra regionen,c=Sverige"},{"dn":"ou=SVF Akut myeloisk leukemi,o=Jämtlands läns landsting,st=Norra regionen,c=Sverige","previousDn":"","publicDn":"ou=Akut myeloisk leukemi (AML),ou=Region Jämtland Härjedalen,o=RCC Norr,ou=Sverige","alternativeId":"VN6","specific":{}},{"dn":"ou=SVF Cancer i urinblåsan och övre urinvägarna,o=Jämtlands läns landsting,st=Norra regionen,c=Sverige","previousDn":"","publicDn":"ou=Cancer i urinblåsan och övre urinvägarna,ou=Region Jämtland Härjedalen,o=RCC Norr,ou=Sverige","alternativeId":"VK1","specific":{}},{"dn":"ou=SVF Huvud-och halscancer,o=Jämtlands läns landsting,st=Norra regionen,c=Sverige","previousDn":"","publicDn":"ou=Huvud- och halscancer,ou=Region Jämtland Härjedalen,o=RCC Norr,ou=Sverige","alternativeId":"VA9","specific":{}},{"dn":"ou=SVF Matstrupe-och magsäckscancer,o=Jämtlands läns landsting,st=Norra regionen,c=Sverige","previousDn":"","publicDn":"ou=Matstrups- och magsäckscancer,ou=Region Jämtland Härjedalen,o=RCC Norr,ou=Sverige","alternativeId":"VB0","specific":{}},{"dn":"ou=SVF Prostatacancer,o=Jämtlands läns landsting,st=Norra regionen,c=Sverige","previousDn":"","publicDn":"ou=Prostatacancer,ou=Region Jämtland Härjedalen,o=RCC Norr,ou=Sverige","alternativeId":"VJ1","specific":{}}],"alternativeIdSystem":"KVÅ kod","specific":{"signedBy":"Björn Eriksson Regiondirektör","invitations":600}}