{
    "measurement": {
        "name": "Somatik öppenvård 2015 Region Gävleborg",
        "grouping": "Somatik öppenvård",
        "period": "2015"
    },
    "dn": "o=Landstinget Gävleborg,st=Uppsala-Örebro regionen,c=Sverige",
    "selectionCriterias": [
        {
            "name": "Somatik öppenvård",
            "versions": [
                {
                  "name": "Alla",
                  "questionnaire": {
                    "name": "Specialiserad sjukhusvård öppen v2.0"
                  }
                }
            ]
        }
    ],
    "organisations": [
        {
          "dn": "o=Landstinget Gävleborg,st=Uppsala-Örebro regionen,c=Sverige"
        }    
    ]
}