{
    "_id" : "58a5a64aa57b4b9473ac27e6",
    "hsaId" : "SE2321000131-E000000000001",
    "hassan" : {
        "dn" : "o=Västra Götalandsregionen,l=Västra Götalands län,c=SE",
        "postalAddress" : [ 
            "Västra Götalandsregionen", 
            "Regionens Hus", 
            "462 80", 
            "Vänersborg"
        ],
        "telephoneNumber" : "+46 501 62000",
        "mail" : "info@vgregion.se",
        "orgNo" : "232100-0131",
        "hsaIdentity" : "SE2321000131-E000000000001",
        "publicName" : "Västra Götalandsregionen",
        "name" : "Västra Götalandsregionen",
        "countyCode" : "14",
        "countyName" : "Västra Götalands Län",
        "businessClassificationCode" : [],
        "businessClassificationName" : [],
        "careType" : [],
        "hsaHealthCareUnitMember" : [],
        "nonPublicTelephoneNumber" : "+46 501 62000",
        "directoryContact" : "anne-berit.fredriksson@vgregion.se",
        "management" : "Landsting/Region",
        "isHsaHealthCareProvider" : "true",
        "hassan" : {
            "batchId" : "7a892c04-f259-11e6-8a7a-a95d56b24893"
        }
    },
    "dn" : "o=Västra Götalandsregionen,l=Västra Götalands län,c=SE",
    "measurement" : {
        "name" : "Standardiserade vårdförlopp inom cancervård 2016",
        "grouping" : "Standardiserade vårdförlopp inom cancervård",
        "period" : "2016"
    },
    "selectionCriterias" : [ 
        {
            "name" : "Alla",
            "versions" : []
        }
    ],
    "organisations" : [ 
        {
            "hsaId" : "SE2321000131-E000000000001",
            "hassan" : {
                "dn" : "o=Västra Götalandsregionen,l=Västra Götalands län,c=SE",
                "postalAddress" : [ 
                    "Västra Götalandsregionen", 
                    "Regionens Hus", 
                    "462 80", 
                    "Vänersborg"
                ],
                "telephoneNumber" : "+46 501 62000",
                "mail" : "info@vgregion.se",
                "orgNo" : "232100-0131",
                "hsaIdentity" : "SE2321000131-E000000000001",
                "publicName" : "Västra Götalandsregionen",
                "name" : "Västra Götalandsregionen",
                "countyCode" : "14",
                "countyName" : "Västra Götalands Län",
                "businessClassificationCode" : [],
                "businessClassificationName" : [],
                "careType" : [],
                "hsaHealthCareUnitMember" : [],
                "nonPublicTelephoneNumber" : "+46 501 62000",
                "directoryContact" : "anne-berit.fredriksson@vgregion.se",
                "management" : "Landsting/Region",
                "isHsaHealthCareProvider" : "true",
                "hassan" : {
                    "batchId" : "7a892c04-f259-11e6-8a7a-a95d56b24893"
                }
            },
            "dn" : "o=Västra Götalandsregionen,l=Västra Götalands län,c=SE"
        }, 
        {
            "hsaId" : "SE2321000198-031623",
            "dn" : "ou=ABC Doctor AB,ou=Bemanningsföretag,ou=Externa,o=Region Gävleborg,l=Gävleborgs län,c=SE",
            "publicDn" : "ou=ABC Doctor AB,ou=Uddevalla,o=Västra Götalands län,c=Sverige",
            "specific" : {}
        }
    ],
    "specific" : {
        "rccs" : "RCC Uppsala Örebro",
        "kvaCodes" : [ 
            "VG9", 
            "VN0", 
            "VB4", 
            "VP9", 
            "VP8", 
            "VN6", 
            "VN2"
        ],
        "signedBy" : "Moiasa",
        "radio" : "VC0",
        "checkbox" : true,
        "invitations" : 6
    },
    "diarie" : {
        "number" : "HS 240-2015"
    }
}