{
  "dn": "o=Norrbottens läns landsting,st=Norra regionen,c=Sverige",
  "measurement": {
    "name": "Standardiserade vårdförlopp inom cancervård 2016",
    "grouping": "Standardiserade vårdförlopp inom cancervård",
    "period": "2016"
  },
  "selectionCriterias": [{
    "name": "Alla",
    "versions": [{
      "name": "vuxen",
      "questionnaire": {
        "name": "Specialiserad sjukhusvård öppen vuxen 2.0"
      }
    }]
  }],
  "organisations": [{
    "dn": "ou=Cancer i urinblåsa och övre urinvägar,o=Norrbottens läns landsting,st=Norra regionen,c=Sverige",
    "hsaId": "",
    "invitation": {
      "softName": "Norrbottens läns landsting"
    },
    "specific": {
      "managerEmails": ["roger.brannstrom@nll.se"]
    },
    "publicDn": "ou=Cancer i urinblåsan och övre urinvägarna,o=Norrbottens läns landsting,o=RCC Norr,c=Sverige",
    "metadata": {
      "producer": "Landstingsdrivet",
      "doneEdit": true
    },
    "alternativeId": "VK1"
  }, {
    "dn": "ou=Huvud och halscancer,o=Norrbottens läns landsting,st=Norra regionen,c=Sverige",
    "previousDn": "",
    "publicDn": "ou=Huvud- och halscancer,o=Norrbottens läns landsting,o=RCC Norr,c=Sverige",
    "invitation": {
      "softName": "Norrbottens läns landsting"
    },
    "hsaId": "",
    "specific": {
      "managerEmails": ["Susanna.Marklund@nll.se"]
    },
    "metadata": {
      "producer": "Landstingsdrivet",
      "doneEdit": true
    },
    "alternativeId": "VA9"
  }, {
    "dn": "ou=Matstrups- och magsäckscancer,o=Norrbottens läns landsting,st=Norra regionen,c=Sverige",
    "previousDn": "",
    "publicDn": "ou=Matstrups- och magsäckscancer,o=Norrbottens läns landsting,o=RCC Norr,c=Sverige",
    "invitation": {
      "softName": "Norrbottens läns landsting"
    },
    "hsaId": "",
    "specific": {
      "managerEmails": ["Marcus.Sunden@nll.se"]
    },
    "metadata": {
      "producer": "Landstingsdrivet",
      "doneEdit": true
    },
    "alternativeId": "VB0"
  }, {
    "dn": "ou=Akut myeloisk leukemi (AML),o=Norrbottens läns landsting,st=Norra regionen,c=Sverige",
    "previousDn": "",
    "publicDn": "ou=Akut myeloisk leukemi (AML),o=Norrbottens läns landsting,o=RCC Norr,ou=Sverige",
    "hsaId": "",
    "specific": {
      "managerEmails": ["birgitta.lauri@nll.se"]
    },
    "invitation": {
      "softName": "Norrbottens läns landsting"
    },
    "metadata": {
      "producer": "Landstingsdrivet",
      "doneEdit": true
    },
    "alternativeId": "VN6"
  }, {
    "metadata": {
      "doneEdit": true
    },
    "hsaId": "SE2321000230-E00001",
    "dn": "o=Norrbottens läns landsting,st=Norra regionen,c=Sverige",
    "specific": {
      "managerEmails": ["Michael.Dahlberg@nll.se", "carina.eriksson@nll.se", "eva.sjolund@nll.se"]
    }
  }, {
    "dn": "ou=Prostatacancer,o=Norrbottens läns landsting,st=Norra regionen,c=Sverige",
    "previousDn": "",
    "publicDn": "ou=Prostatacancer,o=Norrbottens läns landsting,o=RCC Norr,c=Sverige",
    "invitation": {
      "softName": "Norrbottens läns landsting"
    },
    "hsaId": "",
    "specific": {
      "managerEmails": ["Roger.Brannstrom@nll.se"]
    },
    "metadata": {
      "producer": "Landstingsdrivet",
      "doneEdit": true
    },
    "alternativeId": "VJ1"
  }],
  "alternativeIdSystem": "KVÅ kod",
  "specific": {
    "signedBy": "Eva Sjölund",
    "invitations": 1040
  }
}